Code,Title,Description
mediationBody,Mediation body,The body responsible for mediation procedures.
centralPurchasingBody,Central purchasing body,"The procuring entity providing centralized purchasing activities and, possibly, ancillary purchasing activities."
processContactPoint,Process contact point,A contact point dedicated to this contracting process.
reviewContactPoint,Review contact point,The service from which information about the review procedure can be obtained.
selectedParticipant,Selected participant,A party that has already been selected to participate in the design contest.
